Course Name,Institution Name,Abbrv.,Direct Entry Requirements,UTME Requirements,Subjects
INDUSTRIAL TECHNOLOGY EDUCATION,"FEDERAL COLLEGE OF EDUCATION, GUSAU, (AFFL TO FUT, MINNA), ZAMFARA STATE",GUSAU-DEG,"(i)    Two (2) 'A' Level passes in Physics and Mathematics.

(ii)   ND lower credit in Civil Engineering, Production/Electrical Engineering.

(iii)    Final City and Guilds or its equivalent plus National Technical Certificate.

(iv) NCE credit  in Technical Education plus 'O' Level credit passes in Physics or Mathematics.",Five (5) 'O' Level credit passes to include Physics or Mathematics.,"Mathematics, Physics and one (1) other Science subject."
WOODWORK TECHNOLOGY EDUCATION,"FEDERAL COLLEGE OF EDUCATION, GUSAU, (AFFL TO FUT, MINNA), ZAMFARA STATE",GUSAU-DEG,"NCE merit in relevant subjects.

 

 Two (2) 'A' Level passes in the subjects listed under the UTME requirements.","Five (5) 'O' Level credit passes in English Language Mathematics and one (1) of Biology /Agricultural Science; Physics, or Chemistry and two (2) from General Science/IntegratedScience, Technical Drawing/Fine Art, Geography, Health Science Food and Nutrition, Physical and Health Education, Auto Technical, Building, Electrical Electronic, Metal Work and Wood Work.","Math, Physics and any other subject."
